{
  "$schema": "https://json-schema.org/draft/2020-12/schema",
  "$id": "https://obligationfirst.org/v1/schema/instrument.schema.json",
  "title": "Instrument",
  "description": "An artifact with binding force — a law, regulation, agreement, ruling, or analogous instrument. Bound to gist:Agreement (for negotiated artifacts) or gist:Specification (for promulgated artifacts).",
  "type": "object",
  "required": ["@type", "@id", "title", "issuedBy"],
  "properties": {
    "@context": { "type": ["string", "array", "object"] },
    "@id": { "type": "string", "format": "uri" },
    "@type": { "const": "of:Instrument" },
    "title": { "type": "string", "minLength": 1 },
    "short_title": { "type": "string" },
    "citation": { "type": "string", "description": "Authoritative legal citation (e.g., Bluebook, ELI, ECLI)." },
    "issuedBy": {
      "type": "string",
      "format": "uri",
      "description": "IRI of the Authority that promulgated this Instrument."
    },
    "kind": {
      "type": "string",
      "description": "Open vocabulary for Instrument subtype.",
      "examples": [
        "statute",
        "regulation",
        "executive-order",
        "agreement",
        "jia",
        "rma",
        "no-action-letter",
        "advisory-opinion",
        "private-letter-ruling",
        "judgment",
        "consent-decree"
      ]
    },
    "enacted": { "type": "string", "format": "date" },
    "effective": { "type": "string", "format": "date" },
    "status": {
      "type": "string",
      "enum": ["proposed", "enacted", "in-force", "amended", "sunset", "repealed", "superseded", "withdrawn"],
      "description": "Legislative state. Closed enum. v0.1 ships an initial vocabulary; v0.2 may formalize the state machine."
    },
    "enforcement_status": {
      "type": "string",
      "enum": ["routine", "constrained", "unsignaled"],
      "default": "routine",
      "description": "Whether the Instrument's primary obligations can presently be enforced. Independent from `status`. The cause of a non-routine state is NOT encoded here — causes are expressed via the proceeding strand (a Determination that anchors to the affected Obligation). See PROTOCOL.md 'Why enforcement cause lives in the proceeding strand' for the design rationale."
    },
    "supersedes": {
      "type": "array",
      "items": { "type": "string", "format": "uri" },
      "description": "IRIs of of:Instrument records this Instrument has replaced. Post-enactment relation. Does NOT imply Term-level defeats; cross-Term overrides must be asserted explicitly via of:defeats."
    },
    "wouldSupersede": {
      "type": "array",
      "items": { "type": "string", "format": "uri" },
      "description": "IRIs of of:Instrument records this Instrument would replace if enacted. Subjunctive — used by proposed or amended-in-flux Instruments. Migrate to `supersedes` once enactment occurs."
    },
    "hasTerm": {
      "type": "array",
      "items": { "type": "string", "format": "uri" },
      "description": "IRIs of of:Term records belonging to this Instrument."
    },
    "source": { "type": "string", "format": "uri", "description": "Authoritative source-text URL (PDF, HTML, or canonical hosted version)." },
    "akn_uri": { "type": "string", "format": "uri", "description": "Akoma Ntoso element IRI when an authoritative encoding exists." },
    "eli_uri": { "type": "string", "format": "uri", "description": "ELI URI when one exists." },
    "urn_lex": {
      "type": "string",
      "pattern": "^urn:lex:",
      "description": "urn:lex identifier for the Instrument. Crosswalk fallback where the jurisdiction issues no ELI (crosswalk matrix in PROTOCOL.md)."
    },
    "jurisdiction": {
      "type": "object",
      "required": ["@type", "ref"],
      "properties": {
        "@type": { "const": "gist:Jurisdiction" },
        "ref": {
          "type": "string",
          "description": "Jurisdiction code: lowercase form of an ISO 3166-1 alpha-2 country/supranational code or an ISO 3166-2 subdivision code.",
          "examples": ["us-co", "ca-bc", "eu", "us"]
        }
      }
    },
    "sameAs": {
      "type": "array",
      "items": { "type": "string", "format": "uri" },
      "description": "owl:sameAs crosswalk IRIs: external records identical to this one (e.g. a live adopter export, a Wikidata entity)."
    },
    "exactMatch": {
      "type": "array",
      "items": { "type": "string", "format": "uri" },
      "description": "skos:exactMatch crosswalk IRIs: external concepts interchangeably usable with this record. Weaker than owl:sameAs; preferred for cross-scheme concept joins."
    },
    "notes": { "type": "string", "description": "Free-text editorial or provenance notes about this record." }
  },
  "additionalProperties": true
}
